{
  "episode_id": "example-episode",
  "scene_index": 1,
  "scene_duration_final_s": 3.2,
  "utterances": [
    {
      "utterance_id": "utt_001",
      "audio_clip_path": "artifacts/audio_events/example-episode/scene_01/utt_001.mp3",
      "audio_duration_s": 2.9,
      "scene_audio_start_s": 0.0,
      "scene_audio_end_s": 2.9
    }
  ],
  "event_bindings": [
    {
      "event_id": "scene_01_ev_001",
      "utterance_id": "utt_001",
      "speech_start_s": 0.0,
      "speech_end_s": 2.9,
      "visible_start_s": 0.0,
      "visible_end_s": 3.2,
      "audio_start_s": 0.0,
      "audio_end_s": 2.9,
      "pre_roll_clean_s": 0.0,
      "legibility_floor_s": 3.2
    }
  ]
}
